{
  "scheme_id": "semantic-normalizer-core",
  "version": "0.1.0",
  "default_language": "en",
  "supported_languages": [
    "en",
    "pt"
  ],
  "concepts": [
    {
      "concept_id": "role.operator",
      "preferred_labels": {
        "en": "operator",
        "pt": "operador"
      },
      "alternative_labels": {
        "en": [
          "machine operator"
        ],
        "pt": [
          "operador da máquina"
        ]
      },
      "hidden_labels": {
        "en": [],
        "pt": []
      },
      "surface_forms": {
        "en": [
          "operators"
        ],
        "pt": [
          "operadora",
          "operadores",
          "operadoras"
        ]
      },
      "definitions": {
        "en": "A person who operates or controls a machine, system, or process.",
        "pt": "Pessoa que opera ou controla uma máquina, um sistema ou um processo."
      },
      "part_of_speech": "noun",
      "domains": [
        "general",
        "operations"
      ],
      "context_terms": {
        "positive": {
          "en": [
            "machine",
            "system",
            "control"
          ],
          "pt": [
            "máquina",
            "sistema",
            "controle"
          ]
        },
        "negative": {
          "en": [],
          "pt": []
        }
      },
      "source_authority": "project-core-0.1"
    },
    {
      "concept_id": "action.start",
      "preferred_labels": {
        "en": "start",
        "pt": "iniciar"
      },
      "alternative_labels": {
        "en": [
          "begin",
          "commence"
        ],
        "pt": [
          "começar",
          "dar início"
        ]
      },
      "hidden_labels": {
        "en": [],
        "pt": []
      },
      "surface_forms": {
        "en": [
          "starts",
          "started",
          "starting"
        ],
        "pt": [
          "inicie",
          "inicia",
          "iniciou",
          "iniciando",
          "comece",
          "começa",
          "começou",
          "começando"
        ]
      },
      "definitions": {
        "en": "Cause an operation, process, or system to begin.",
        "pt": "Fazer uma operação, processo ou sistema começar."
      },
      "part_of_speech": "verb",
      "domains": [
        "general",
        "software",
        "operations"
      ],
      "context_terms": {
        "positive": {
          "en": [
            "server",
            "service",
            "process",
            "system"
          ],
          "pt": [
            "servidor",
            "serviço",
            "processo",
            "sistema"
          ]
        },
        "negative": {
          "en": [],
          "pt": []
        }
      },
      "source_authority": "project-core-0.1",
      "related": [
        "action.stop",
        "action.restart"
      ]
    },
    {
      "concept_id": "action.stop",
      "preferred_labels": {
        "en": "stop",
        "pt": "parar"
      },
      "alternative_labels": {
        "en": [
          "halt",
          "cease"
        ],
        "pt": [
          "cessar"
        ]
      },
      "hidden_labels": {
        "en": [],
        "pt": []
      },
      "surface_forms": {
        "en": [
          "stops",
          "stopped",
          "stopping"
        ],
        "pt": [
          "pare",
          "para",
          "parou",
          "parando"
        ]
      },
      "definitions": {
        "en": "Cause an operation, process, or system to cease running.",
        "pt": "Fazer uma operação, processo ou sistema deixar de funcionar."
      },
      "part_of_speech": "verb",
      "domains": [
        "general",
        "software",
        "operations"
      ],
      "context_terms": {
        "positive": {
          "en": [
            "server",
            "service",
            "process",
            "system"
          ],
          "pt": [
            "servidor",
            "serviço",
            "processo",
            "sistema"
          ]
        },
        "negative": {
          "en": [],
          "pt": []
        }
      },
      "source_authority": "project-core-0.1",
      "related": [
        "action.start",
        "action.restart"
      ]
    },
    {
      "concept_id": "action.restart",
      "preferred_labels": {
        "en": "restart",
        "pt": "reiniciar"
      },
      "alternative_labels": {
        "en": [
          "reboot"
        ],
        "pt": [
          "reinicializar"
        ]
      },
      "hidden_labels": {
        "en": [],
        "pt": []
      },
      "surface_forms": {
        "en": [
          "restarts",
          "restarted",
          "restarting"
        ],
        "pt": [
          "reinicie",
          "reinicia",
          "reiniciou",
          "reiniciando"
        ]
      },
      "definitions": {
        "en": "Stop and then start a system, service, or device.",
        "pt": "Parar e depois iniciar um sistema, serviço ou dispositivo."
      },
      "part_of_speech": "verb",
      "domains": [
        "software",
        "operations"
      ],
      "context_terms": {
        "positive": {
          "en": [
            "server",
            "service",
            "device",
            "system"
          ],
          "pt": [
            "servidor",
            "serviço",
            "dispositivo",
            "sistema"
          ]
        },
        "negative": {
          "en": [],
          "pt": []
        }
      },
      "source_authority": "project-core-0.1",
      "related": [
        "action.start",
        "action.stop"
      ]
    },
    {
      "concept_id": "action.verify",
      "preferred_labels": {
        "en": "verify",
        "pt": "verificar"
      },
      "alternative_labels": {
        "en": [
          "check"
        ],
        "pt": [
          "checar",
          "conferir"
        ]
      },
      "hidden_labels": {
        "en": [],
        "pt": []
      },
      "surface_forms": {
        "en": [
          "verifies",
          "verified",
          "verifying",
          "checks",
          "checked",
          "checking"
        ],
        "pt": [
          "verifique",
          "verifica",
          "verificou",
          "verificando",
          "cheque",
          "confira"
        ]
      },
      "definitions": {
        "en": "Examine evidence to determine whether a condition or value is correct.",
        "pt": "Examinar evidências para determinar se uma condição ou valor está correto."
      },
      "part_of_speech": "verb",
      "domains": [
        "general",
        "quality",
        "software"
      ],
      "context_terms": {
        "positive": {
          "en": [
            "code",
            "status",
            "value",
            "result"
          ],
          "pt": [
            "código",
            "status",
            "valor",
            "resultado"
          ]
        },
        "negative": {
          "en": [],
          "pt": []
        }
      },
      "source_authority": "project-core-0.1"
    },
    {
      "concept_id": "action.install",
      "preferred_labels": {
        "en": "install",
        "pt": "instalar"
      },
      "alternative_labels": {
        "en": [],
        "pt": []
      },
      "hidden_labels": {
        "en": [],
        "pt": []
      },
      "surface_forms": {
        "en": [
          "installs",
          "installed",
          "installing"
        ],
        "pt": [
          "instale",
          "instala",
          "instalou",
          "instalando"
        ]
      },
      "definitions": {
        "en": "Put software, equipment, or a component in its required operating position or environment.",
        "pt": "Colocar software, equipamento ou componente na posição ou ambiente necessário para operação."
      },
      "part_of_speech": "verb",
      "domains": [
        "software",
        "hardware",
        "operations"
      ],
      "context_terms": {
        "positive": {
          "en": [
            "package",
            "software",
            "component",
            "panel"
          ],
          "pt": [
            "pacote",
            "software",
            "componente",
            "painel"
          ]
        },
        "negative": {
          "en": [],
          "pt": []
        }
      },
      "source_authority": "project-core-0.1"
    },
    {
      "concept_id": "action.configure",
      "preferred_labels": {
        "en": "configure",
        "pt": "configurar"
      },
      "alternative_labels": {
        "en": [
          "set up"
        ],
        "pt": [
          "ajustar a configuração"
        ]
      },
      "hidden_labels": {
        "en": [],
        "pt": []
      },
      "surface_forms": {
        "en": [
          "configures",
          "configured",
          "configuring"
        ],
        "pt": [
          "configure",
          "configura",
          "configurou",
          "configurando"
        ]
      },
      "definitions": {
        "en": "Set parameters or connections so a system operates as required.",
        "pt": "Definir parâmetros ou conexões para que um sistema opere como necessário."
      },
      "part_of_speech": "verb",
      "domains": [
        "software",
        "hardware",
        "operations"
      ],
      "context_terms": {
        "positive": {
          "en": [
            "parameter",
            "setting",
            "server",
            "service"
          ],
          "pt": [
            "parâmetro",
            "configuração",
            "servidor",
            "serviço"
          ]
        },
        "negative": {
          "en": [],
          "pt": []
        }
      },
      "source_authority": "project-core-0.1"
    },
    {
      "concept_id": "action.remove_physical",
      "preferred_labels": {
        "en": "remove",
        "pt": "remover"
      },
      "alternative_labels": {
        "en": [
          "detach"
        ],
        "pt": [
          "retirar",